{"attempts_sha256":"68052eb853d9c956bd1f1b3992500003b60cd6cefdd5247db2ebb57ff5a72d51","heldout_records_sha256":"1a4ce978e056866d0c5fc6f2a9ee5cd4bf7f49caf9bc13cfcee3edd4394382d4","manifest_id":"evaluation-generation-manifest-v1-heldout-evaluation-v1-20260717-run01","run_configuration_sha256":"6afb8951b1948ced2cffb29821a6881035679069379a7bdefcce04c959d5ed43","run_id":"heldout-evaluation-v1-20260717-run01","run_records_sha256":"069b36e4019ca417a50861d3ec18d263675eeb706f84ea4080c9cd6e07e995e4","scheduled_attempt_count":240,"schema_version":1,"source_harness_inspection_sha256":"b14f18ff20c1aa305f6c68866927d476e1b0a48cbd84d33d31833ba9782d774d","source_harness_manifest_path":"experiments/runs/heldout-evaluation-v1-20260717-run01/manifest.json","source_harness_manifest_sha256":"ad47e4748641208f5e65b1f73e4ee8d99a01b56c508b62a9fe8eebc9a8585642","source_harness_prompts_sha256":"bbdc0ec9de80876c854f551f92b5143da3476e55e3b65cbe36c50eef9f3983d0","source_harness_responses_sha256":"69a8d5eb0984bff12867a3b3fec9eddba01b9c73a51a48131ecfbac1a2224c60","systems":[{"adapter_enabled":false,"adapter_sha256":null,"generation_config_sha256":"deb8801aef98cf5e91fe3ca945033279181244e5f7e4341ba7ef5f69ca3e60d1","model_sha256":"dd924a11b4c220f385b51ffa522daea7c9f3d850e31b162bb5661df483c6d3ee","prompt_asset_sha256":"f09b7712fb9b36c9fc6fc54b1fc72fbf2d95cc8e5e1d8d570d88a54ccde2d821","system_configuration_sha256":"5cbf2c4ac9176578e76c899f20fa990e6413a4d908dd5bf0973ffa5941b770f8","system_id":"A"},{"adapter_enabled":false,"adapter_sha256":null,"generation_config_sha256":"deb8801aef98cf5e91fe3ca945033279181244e5f7e4341ba7ef5f69ca3e60d1","model_sha256":"dd924a11b4c220f385b51ffa522daea7c9f3d850e31b162bb5661df483c6d3ee","prompt_asset_sha256":"cdd68af07f6668c8526c357a7f9df6600d95cbfa03da83bcb5280ee053a89d31","system_configuration_sha256":"41d8ad13d67a8e2ea3520651550da8e7c43b0cb7addf6d0de6ae6b9ea74bc9a9","system_id":"B"},{"adapter_enabled":true,"adapter_sha256":"0eef1d5da017a18f571a5e37cc152d1351bfbda9f0d343c3f376a1f68a2d4249","generation_config_sha256":"deb8801aef98cf5e91fe3ca945033279181244e5f7e4341ba7ef5f69ca3e60d1","model_sha256":"dd924a11b4c220f385b51ffa522daea7c9f3d850e31b162bb5661df483c6d3ee","prompt_asset_sha256":"f09b7712fb9b36c9fc6fc54b1fc72fbf2d95cc8e5e1d8d570d88a54ccde2d821","system_configuration_sha256":"3d3e25fa83050a7b1e80cd0ac5fba985e163e10117e26792bf5290e273084bb0","system_id":"C"},{"adapter_enabled":true,"adapter_sha256":"0eef1d5da017a18f571a5e37cc152d1351bfbda9f0d343c3f376a1f68a2d4249","generation_config_sha256":"deb8801aef98cf5e91fe3ca945033279181244e5f7e4341ba7ef5f69ca3e60d1","model_sha256":"dd924a11b4c220f385b51ffa522daea7c9f3d850e31b162bb5661df483c6d3ee","prompt_asset_sha256":"cdd68af07f6668c8526c357a7f9df6600d95cbfa03da83bcb5280ee053a89d31","system_configuration_sha256":"915ff6fad7b1632d07e4ec7a72d65d9bc665adeda47d8ba6a12fb59efa211acc","system_id":"D"}]}
